[
  {
    "id": "CMP-001",
    "client": "Acme Media",
    "lane": "content",
    "owner": "Head of Client Services",
    "sectionStartDate": "2026-02-03",
    "sectionDay": 17,
    "gates": { "gateA": "met", "gateB": "pending", "gateC": "pending", "gateD": "pending" },
    "forecastDay": 35,
    "publishByDate": "2026-04-04",
    "promotionDaysRemaining": 52,
    "bufferBurnPercent": 45,
    "blockedOverdueBusinessDays": 0,
    "externalDependencyBlocked": false,
    "qualityRiskFlag": false,
    "reviewClass": "B",
    "touchpoints": {
      "planningCallDate": "2026-02-05",
      "interviewDate": null,
      "reviewRequestedAt": "2026-02-17T09:00:00Z",
      "reviewApprovedAt": null,
      "backupContact": "client-ops@acme.example",
      "eventConflict": false
    },
    "tokens": { "internalProduction": true, "review": false, "clientTouchpoint": true },
    "flags": { "legalCompliance": false, "churnThreat": false, "reputational": false },
    "slaDeadline": "2026-02-21T12:00:00Z"
  },
  {
    "id": "CMP-002",
    "client": "Northwind B2B",
    "lane": "content",
    "owner": "Production Editor",
    "sectionStartDate": "2026-01-15",
    "sectionDay": 36,
    "gates": { "gateA": "met", "gateB": "met", "gateC": "pending", "gateD": "pending" },
    "forecastDay": 64,
    "publishByDate": "2026-03-15",
    "promotionDaysRemaining": 28,
    "bufferBurnPercent": 86,
    "blockedOverdueBusinessDays": 3,
    "externalDependencyBlocked": true,
    "qualityRiskFlag": true,
    "reviewClass": "A",
    "touchpoints": {
      "planningCallDate": "2026-01-17",
      "interviewDate": null,
      "reviewRequestedAt": "2026-02-14T10:00:00Z",
      "reviewApprovedAt": null,
      "backupContact": "marketing@northwind.example",
      "eventConflict": true
    },
    "tokens": { "internalProduction": true, "review": false, "clientTouchpoint": false },
    "flags": { "legalCompliance": false, "churnThreat": false, "reputational": false },
    "slaDeadline": "2026-02-20T16:00:00Z"
  },
  {
    "id": "CMP-003",
    "client": "Globex Events",
    "lane": "activation",
    "owner": "CS Lead",
    "sectionStartDate": "2026-02-01",
    "sectionDay": 19,
    "gates": { "gateA": "met", "gateB": "met", "gateC": "met", "gateD": "pending" },
    "forecastDay": 24,
    "publishByDate": "2026-03-20",
    "promotionDaysRemaining": 41,
    "bufferBurnPercent": 20,
    "blockedOverdueBusinessDays": 0,
    "externalDependencyBlocked": false,
    "qualityRiskFlag": false,
    "reviewClass": "C",
    "touchpoints": {
      "planningCallDate": "2026-02-01",
      "interviewDate": "2026-02-03",
      "reviewRequestedAt": null,
      "reviewApprovedAt": null,
      "backupContact": "team@globex.example",
      "eventConflict": false
    },
    "tokens": { "internalProduction": true, "review": true, "clientTouchpoint": true },
    "flags": { "legalCompliance": false, "churnThreat": false, "reputational": false },
    "slaDeadline": "2026-02-24T12:00:00Z"
  },
  {
    "id": "CMP-004",
    "client": "Initech",
    "lane": "content",
    "owner": "Head of Client Services",
    "sectionStartDate": "2026-01-20",
    "sectionDay": 31,
    "gates": { "gateA": "met", "gateB": "pending", "gateC": "pending", "gateD": "pending" },
    "forecastDay": 18,
    "publishByDate": "2026-03-22",
    "promotionDaysRemaining": 36,
    "bufferBurnPercent": 10,
    "blockedOverdueBusinessDays": 0,
    "externalDependencyBlocked": false,
    "qualityRiskFlag": false,
    "reviewClass": "A",
    "touchpoints": {
      "planningCallDate": "2026-01-22",
      "interviewDate": "2026-01-28",
      "reviewRequestedAt": "2026-02-19T10:00:00Z",
      "reviewApprovedAt": null,
      "backupContact": "ops@initech.example",
      "eventConflict": false
    },
    "tokens": { "internalProduction": true, "review": true, "clientTouchpoint": true },
    "flags": { "legalCompliance": true, "churnThreat": false, "reputational": false },
    "slaDeadline": "2026-02-20T10:00:00Z"
  }
]
